{
  "schemaVersion": "1",
  "band": "A1",
  "lessons": [
    { "lessonId": "social-contact", "ordinal": 1, "displayName": "Social Contact" },
    { "lessonId": "personal-information", "ordinal": 2, "displayName": "Personal Information" },
    { "lessonId": "family", "ordinal": 3, "displayName": "Family and Relationships" },
    { "lessonId": "surroundings", "ordinal": 4, "displayName": "Immediate Surroundings" },
    { "lessonId": "food-and-drink", "ordinal": 5, "displayName": "Food and Drink" },
    { "lessonId": "buying-things", "ordinal": 6, "displayName": "Buying Things" },
    { "lessonId": "time", "ordinal": 7, "displayName": "Time and Scheduling" },
    { "lessonId": "daily-life", "ordinal": 8, "displayName": "Daily Life" },
    { "lessonId": "places", "ordinal": 9, "displayName": "Places and Directions" },
    { "lessonId": "transport-and-tickets", "ordinal": 10, "displayName": "Transport and Tickets" },
    { "lessonId": "weather", "ordinal": 11, "displayName": "Weather and Environment" },
    { "lessonId": "body-and-feeling-unwell", "ordinal": 12, "displayName": "The Body and Feeling Unwell" },
    { "lessonId": "wants-and-needs", "ordinal": 13, "displayName": "Simple Wants, Needs and Intentions" },
    { "lessonId": "likes-and-dislikes", "ordinal": 14, "displayName": "Likes, Dislikes and Simple Reactions" },
    { "lessonId": "asking-for-help-understanding", "ordinal": 15, "displayName": "Asking for Help Understanding" }
  ],
  "competencies": [
    { "competencyId": "greet", "lessonId": "social-contact", "displayName": "Greet", "cefrDescriptor": "Can greet someone and respond to a greeting.", "interpretLexiconCategory": "greeting" },
    { "competencyId": "ask-how-are-you", "lessonId": "social-contact", "displayName": "Ask how someone is", "cefrDescriptor": "Can ask how someone is." },
    { "competencyId": "say-how-i-am", "lessonId": "social-contact", "displayName": "Say how they are", "cefrDescriptor": "Can say how they are feeling in simple terms." },
    { "competencyId": "introduce-self", "lessonId": "social-contact", "displayName": "Introduce self", "cefrDescriptor": "Can say their own name and introduce themselves simply." },
    { "competencyId": "ask-name", "lessonId": "social-contact", "displayName": "Ask someone's name", "cefrDescriptor": "Can ask what someone is called." },
    { "competencyId": "state-name", "lessonId": "social-contact", "displayName": "State their name", "cefrDescriptor": "Can say what they are called." },
    { "competencyId": "introduce-other", "lessonId": "social-contact", "displayName": "Introduce another person", "cefrDescriptor": "Can introduce one person to another." },
    { "competencyId": "ask-origin", "lessonId": "social-contact", "displayName": "Ask where someone is from", "cefrDescriptor": "Can ask where someone comes from." },
    { "competencyId": "state-origin", "lessonId": "social-contact", "displayName": "State where they are from", "cefrDescriptor": "Can say where they come from." },
    { "competencyId": "ask-residence", "lessonId": "social-contact", "displayName": "Ask where someone lives", "cefrDescriptor": "Can ask where someone lives." },
    { "competencyId": "state-residence", "lessonId": "social-contact", "displayName": "State where they live", "cefrDescriptor": "Can say where they live." },
    { "competencyId": "address-politely", "lessonId": "social-contact", "displayName": "Address someone politely", "cefrDescriptor": "Can use a simple polite form of address." },
    { "competencyId": "say-please", "lessonId": "social-contact", "displayName": "Say please", "cefrDescriptor": "Can attach the everyday politeness word to a simple request." },
    { "competencyId": "thank", "lessonId": "social-contact", "displayName": "Thank", "cefrDescriptor": "Can thank someone simply.", "interpretLexiconCategory": "gratitude" },
    { "competencyId": "respond-to-thanks", "lessonId": "social-contact", "displayName": "Respond to thanks", "cefrDescriptor": "Can respond when thanked." },
    { "competencyId": "apologize", "lessonId": "social-contact", "displayName": "Apologize", "cefrDescriptor": "Can apologize briefly." },
    { "competencyId": "get-attention", "lessonId": "social-contact", "displayName": "Get attention politely", "cefrDescriptor": "Can get someone's attention politely." },
    { "competencyId": "farewell", "lessonId": "social-contact", "displayName": "Farewell", "cefrDescriptor": "Can take leave of someone with a simple expression.", "interpretLexiconCategory": "farewell" },

    { "competencyId": "state-age", "lessonId": "personal-information", "displayName": "State their age", "cefrDescriptor": "Can say how old they are." },
    { "competencyId": "ask-age", "lessonId": "personal-information", "displayName": "Ask someone's age", "cefrDescriptor": "Can ask how old someone is." },
    { "competencyId": "state-birthday", "lessonId": "personal-information", "displayName": "Give their birthday", "cefrDescriptor": "Can say when their birthday is." },
    { "competencyId": "ask-birthday", "lessonId": "personal-information", "displayName": "Ask when a birthday is", "cefrDescriptor": "Can ask when someone's birthday is." },
    { "competencyId": "state-occupation", "lessonId": "personal-information", "displayName": "State their occupation", "cefrDescriptor": "Can say what they do." },
    { "competencyId": "ask-occupation", "lessonId": "personal-information", "displayName": "Ask what someone does", "cefrDescriptor": "Can ask what someone does." },
    { "competencyId": "give-phone-number", "lessonId": "personal-information", "displayName": "Give a phone number", "cefrDescriptor": "Can give a phone number." },
    { "competencyId": "ask-phone-number", "lessonId": "personal-information", "displayName": "Ask for a phone number", "cefrDescriptor": "Can ask for a phone number." },
    { "competencyId": "give-email", "lessonId": "personal-information", "displayName": "Give an email address", "cefrDescriptor": "Can give an email address." },
    { "competencyId": "spell-name", "lessonId": "personal-information", "displayName": "Spell their name", "cefrDescriptor": "Can spell their own name aloud." },
    { "competencyId": "ask-spelling", "lessonId": "personal-information", "displayName": "Ask how something is spelled", "cefrDescriptor": "Can ask how a word or name is spelled." },
    { "competencyId": "state-languages", "lessonId": "personal-information", "displayName": "State languages they speak", "cefrDescriptor": "Can say which languages they speak." },
    { "competencyId": "ask-languages", "lessonId": "personal-information", "displayName": "Ask which languages someone speaks", "cefrDescriptor": "Can ask which languages someone speaks." },
    { "competencyId": "confirm-understanding", "lessonId": "personal-information", "displayName": "Say whether they understand", "cefrDescriptor": "Can say that they do understand." },

    { "competencyId": "name-family-members", "lessonId": "family", "displayName": "Identify family members", "cefrDescriptor": "Can name immediate family members." },
    { "competencyId": "say-who-someone-is", "lessonId": "family", "displayName": "Say who someone is", "cefrDescriptor": "Can say who a person is." },
    { "competencyId": "ask-who-someone-is", "lessonId": "family", "displayName": "Ask who someone is", "cefrDescriptor": "Can ask who a person is." },
    { "competencyId": "describe-relationship", "lessonId": "family", "displayName": "Describe a family relationship", "cefrDescriptor": "Can describe a basic family relationship." },
    { "competencyId": "state-siblings", "lessonId": "family", "displayName": "State whether they have siblings", "cefrDescriptor": "Can say whether they have brothers or sisters." },
    { "competencyId": "ask-siblings", "lessonId": "family", "displayName": "Ask whether someone has siblings", "cefrDescriptor": "Can ask whether someone has brothers or sisters." },
    { "competencyId": "describe-appearance", "lessonId": "family", "displayName": "Describe someone's appearance", "cefrDescriptor": "Can describe a person using basic physical traits." },
    { "competencyId": "describe-personality", "lessonId": "family", "displayName": "Describe someone's character", "cefrDescriptor": "Can describe a person using basic personality adjectives." },
    { "competencyId": "express-affection", "lessonId": "family", "displayName": "Express affection or dislike", "cefrDescriptor": "Can express simple affection or dislike for someone." },

    { "competencyId": "name-objects", "lessonId": "surroundings", "displayName": "Name familiar objects", "cefrDescriptor": "Can identify and name common everyday objects." },
    { "competencyId": "state-object-location", "lessonId": "surroundings", "displayName": "Say where an object is", "cefrDescriptor": "Can say where an object is." },
    { "competencyId": "ask-object-location", "lessonId": "surroundings", "displayName": "Ask where an object is", "cefrDescriptor": "Can ask where an object is." },
    { "competencyId": "understand-location", "lessonId": "surroundings", "displayName": "Understand location words", "cefrDescriptor": "Can understand basic location words." },
    { "competencyId": "describe-room", "lessonId": "surroundings", "displayName": "Describe a room", "cefrDescriptor": "Can describe a room in simple terms." },
    { "competencyId": "say-what-they-have", "lessonId": "surroundings", "displayName": "Say what they have", "cefrDescriptor": "Can say what they have." },
    { "competencyId": "ask-availability", "lessonId": "surroundings", "displayName": "Ask whether something is available", "cefrDescriptor": "Can ask whether something is available." },
    { "competencyId": "describe-colour-and-size", "lessonId": "surroundings", "displayName": "Describe colour and size", "cefrDescriptor": "Can describe basic colours and sizes." },